{
  "protocol": "jiabu.template/1",
  "id": "jiabu.checkup",
  "version": 1,
  "name": {"zh-Hans": "体检", "en": "Health check-up"},
  "description": {"zh-Hans": "年度体检、入学体检等的结果", "en": "Results of an annual or school health check-up"},
  "subjects": [{"kind": "family_member", "min": 1, "max": 1}],
  "event_date_field": "exam_date",
  "title": {"zh-Hans": "{subject}体检 {exam_date}", "en": "{subject} check-up {exam_date}"},
  "fields": [
    {"key": "exam_date", "type": "date", "required": true,
     "label": {"zh-Hans": "检查日期", "en": "Exam date"}},
    {"key": "institution", "type": "text", "max_length": 60,
     "label": {"zh-Hans": "体检机构", "en": "Clinic"}},
    {"key": "height", "type": "number", "unit": "cm", "digits": 1, "min": 40, "max": 230, "metric": "body.height",
     "label": {"zh-Hans": "身高", "en": "Height"}},
    {"key": "weight", "type": "number", "unit": "kg", "digits": 1, "min": 2, "max": 250, "metric": "body.weight",
     "label": {"zh-Hans": "体重", "en": "Weight"}},
    {"key": "bmi", "type": "number", "unit": "kg/m²", "digits": 1, "metric": "body.bmi",
     "label": {"zh-Hans": "BMI", "en": "BMI"}},
    {"key": "bp_systolic", "type": "number", "unit": "mmHg", "digits": 0, "min": 50, "max": 250, "metric": "bp.systolic",
     "label": {"zh-Hans": "收缩压", "en": "Systolic BP"}},
    {"key": "bp_diastolic", "type": "number", "unit": "mmHg", "digits": 0, "min": 30, "max": 150, "metric": "bp.diastolic",
     "label": {"zh-Hans": "舒张压", "en": "Diastolic BP"}},
    {"key": "heart_rate", "type": "number", "unit": "次/分", "units": ["次/分", "bpm"], "digits": 0, "metric": "heart.rate",
     "label": {"zh-Hans": "心率", "en": "Heart rate"}},
    {"key": "fasting", "type": "single_select",
     "label": {"zh-Hans": "是否空腹", "en": "Fasting"},
     "options": [{"id": "yes", "label": {"zh-Hans": "是", "en": "Yes"}},
                 {"id": "no", "label": {"zh-Hans": "否", "en": "No"}}]},
    {"key": "blood_routine", "type": "table", "metric": "blood.cbc",
     "metric_columns": {"item": "item", "value": "result", "unit": "unit"},
     "label": {"zh-Hans": "血常规", "en": "Complete blood count"},
     "columns": [
       {"key": "item", "type": "single_select", "label": {"zh-Hans": "项目", "en": "Item"},
        "options": [{"id": "wbc", "label": {"zh-Hans": "白细胞", "en": "WBC"}},
                    {"id": "rbc", "label": {"zh-Hans": "红细胞", "en": "RBC"}},
                    {"id": "hgb", "label": {"zh-Hans": "血红蛋白", "en": "Hemoglobin"}},
                    {"id": "plt", "label": {"zh-Hans": "血小板", "en": "Platelets"}}]},
       {"key": "result", "type": "number", "label": {"zh-Hans": "结果", "en": "Result"}},
       {"key": "unit", "type": "text", "label": {"zh-Hans": "单位", "en": "Unit"}},
       {"key": "reference", "type": "text", "label": {"zh-Hans": "参考范围", "en": "Reference range"}},
       {"key": "flag", "type": "single_select", "label": {"zh-Hans": "提示", "en": "Flag"},
        "options": [{"id": "normal", "label": {"zh-Hans": "正常", "en": "Normal"}},
                    {"id": "high", "label": {"zh-Hans": "偏高", "en": "High"}},
                    {"id": "low", "label": {"zh-Hans": "偏低", "en": "Low"}}]}]},
    {"key": "conclusion", "type": "text", "multiline": true, "max_length": 2000,
     "label": {"zh-Hans": "总检结论", "en": "Summary"}},
    {"key": "advice", "type": "multi_select",
     "label": {"zh-Hans": "建议", "en": "Follow-up"},
     "options": [{"id": "recheck", "label": {"zh-Hans": "复查", "en": "Re-check"}},
                 {"id": "specialist", "label": {"zh-Hans": "专科就诊", "en": "See a specialist"}},
                 {"id": "lifestyle", "label": {"zh-Hans": "调整生活习惯", "en": "Lifestyle changes"}}]},
    {"key": "report_images", "type": "image", "max_items": 20,
     "label": {"zh-Hans": "报告原图", "en": "Report photos"}}
  ],
  "layout": [
    {"label": {"zh-Hans": "基本信息", "en": "Basics"}, "fields": ["exam_date", "institution", "fasting"]},
    {"label": {"zh-Hans": "身体指标", "en": "Measurements"}, "fields": ["height", "weight", "bmi", "bp_systolic", "bp_diastolic", "heart_rate"]},
    {"label": {"zh-Hans": "化验", "en": "Lab tests"}, "fields": ["blood_routine"]},
    {"label": {"zh-Hans": "结论", "en": "Conclusion"}, "fields": ["conclusion", "advice", "report_images"]}
  ],
  "ai": {
    "extract_from_images": true,
    "hints": "只填报告上能明确看清的数值；看不清或有涂改的项标 uncertain。血常规只填上面列出的四项，其他项写进总检结论。单位按报告原样填写，报告用 bpm 就填 bpm。检查日期以报告上的日期为准，不要用拍照日期。"
  }
}
